original_passage,tagged_words,response_summary,em_score
"
함께 심으면 한쪽 또는 양쪽 모두에게 좋은 영향을 주는식물을 '동반 식물'이라고 합니다. 식물에 따라 함께 심으면좋은 동반 식물이 있습니다. 동반 식물은 도움을 주고받는 방향에 따라 한쪽 식물에게만 도움을 주는 병해충 방제형과 생육 촉진형, 서로 도움을 주고받는 상호 의존형으로나<span adaptation='no'>눌</span> 수 있습니다.
병해충 방제형 동반 식물은 함께 심었을 때 다른 식물이병들거나 해충의 피해를 입는 것을 예방해 줍니다. 예를 들어, 수박이나 오이와 같은 작물은 파와 섞어 심는 것이좋습니다. 파 뿌리에서 나오는 천연 항생 물질이 수박이나 오이에 병과 해충이 생기는 것을 막아 주기 때문입니다.
다음으로 생육 촉진형 동반 식물은 함께 심으면 다른 식물이 성장하는 데 도움을 줍니다. 예를 들어, 가지는 질소를땅속으로 잘 끌어들이는 성질을 가진 콩과 같이 심는 것이좋습니다. 왜냐하면 가지는 성장하는 데 질소 비료를 많이필요로 하기 때문입니다.
마지막으로 상호 의존형 동반 식물은 서로의 부족한 점을 보완해 줍니다. 그래서 함께 심은 식물 모두에게 도움을 줍니다. 예를 들어, 물을 좋아하는 식물인 바질은 건조한 환경을 좋아하는 토마토와 함께 심는 것이 좋습니다. 그러면 땅속의 수분 환경이 적절하게 만들어져서 토마토는 물러 터지지 않고 바질은 마르지 않을 수 있게 됩니다.
예로부터 우리 조상들은 지혜를 발휘하여 텃밭에 채소와꽃, 약초 등을 섞어 심었습니다. 식물의 특성을 고려하여 알맞은 동반 식물을 이웃해 심으면 식물을 더욱 잘 기를수 있습니다.
",['눌'],"식물을 키울 때 어떤 식물들은 서로 도움이 돼요. 이렇게 서로 도움이 되는 식물을 '동반 식물'이라고 해요. 동반 식물은 세 가지로 <span adaptation='no'>눌</span> 수 있어요.

첫 번째로, 어떤 식물은 다른 식물이 아프지 않게 도와줘요. 예를 들어 파는 수박이나 오이가 병에 걸리지 않게 도와줘요. 파 뿌리에서 나오는 물질이 수박과 오이를 지켜주거든요.

두 번째로, 어떤 식물은 다른 식물이 잘 자라도록 도와줘요. 예를 들어 콩은 가지가 잘 자라게 도와줘요. 콩이 가지가 필요한 영양분을 만들어주기 때문이에요.

세 번째로, 어떤 식물들은 서로서로 도움을 주고받아요. 예를 들어 바질과 토마토를 함께 심으면 좋아요. 바질은 물을 좋아하고 토마토는 물을 싫어하는데, 함께 심으면 둘 다 알맞게 자랄 수 있어요.

옛날부터 우리 할아버지, 할머니들은 이런 점을 잘 알고 있었어요. 그래서 텃밭에 여러 식물을 함께 심었어요. 이렇게 서로 돕는 식물을 함께 심으면 식물들이 더 잘 자라요.",1.0
"
10대 청소년의 스마트폰 이용 시간이 늘어가며 스마트폰 중독을 호소하는 학생들이 늘어나고 있다. 과학기술정보통신부의 조사에 따르면, 10대 청소년 10명 중 3명이 스마트폰으로 인해 생활에 지장을 받는 '스마트폰 과의존 위험군'으로 파악되고 있다.
과도한 스마트폰 사용은 학업이나 일상생활에 지장을 줄뿐만 아니라 대인 관계, 사고력과 자기<span adaptation='no'>조절</span>력에도 <span adaptation='no'>문제</span>를 가져오기 때문에 중독을 예방하는 것이 중요하다. 그렇다면 어떻게 스마트폰 중독을 예방할 수 있을까.
첫째, 스마트쉼센터에서 제공하는 각종 진단 테스트에 참여한다. <span adaptation='no'>얼마나</span> 스마트폰에 의존하는 상태인지 스스로 파악하기 어렵다. 객관적인 진단 테스트를 통해 자신의 상태를냉정하게 평가해 볼 필요가 있다.
둘째, 스마트폰 중독 예방을 위한 앱이나 서비스를 사용한다. 걸으면서 스마트폰을 쓰면 화면이 잠기거나, 미리 설정한 시간만큼만 스마트폰을 사용하도록 설정하는 앱을 이용한다.
이와 같이, 스마트폰을 쓰지 않을 수 없다면, 스스로 스마트폰 사용을 절제하는 힘을 길러야 한다. 우리 모두 스마트폰 중독을 예방하기 위해 노력해야 한다.
","['조절', '얼마나', '문제']","요즘 청소년들이 스마트폰을 너무 많이 써서 걱정이에요. 정부 조사를 보면, 10명 중 3명의 청소년이 스마트폰을 너무 많이 쓰고 있대요.

스마트폰을 너무 많이 쓰면 공부도 못 하고, 친구들과 잘 지내기도 어려워요. 생각하는 힘과 자기<span adaptation='no'>조절</span>력에도 <span adaptation='no'>문제</span>가 생길 수 있어요. 그래서 스마트폰을 적당히 쓰는 게 중요해요.

스마트폰을 건강하게 쓰는 방법이 있어요. 먼저, 스마트쉼센터에서 하는 검사를 받아보세요. 내가 스마트폰을 얼마나 많이 쓰는지 정확히 알 수 있어요. 다음으로, 스마트폰을 지나치게 쓰지 않도록 도와주는 앱을 깔아보세요. 걸으면서 스마트폰을 쓰면 화면이 꺼지거나, 정해진 시간만 쓸 수 있게 해주는 앱이 있어요.

스마트폰은 꼭 필요하지만, 너무 많이 쓰지 않도록 조심해야 해요. 우리 모두 스마트폰을 건강하게 쓰도록 노력해요.",0.6666666666666666
"
놀이는 이미 섣달 그믐 무렵부터 즐기기 시작하여 대보름 무렵까지 즐긴다. 연날리기는 섣달 그믐 무렵부터 시작하여 대보름까지 즐긴다. 보름날의 연은 액연이라 하여 멀리 날려보낸다. <span adaptation='no'>원래</span> 보름날 이후에는 연을 날리지 않는 것이다. 그밖에 설날 무렵 윷놀이·널뛰기·승경도놀이·돈치기 등을 한다. 윷놀이는 남녀노소 구별 없이 모든 <span adaptation='no'>사람</span>이 집안에서도 하고 밖에서 마을 사람들이 어울려 하는 정초의 가장 보편적인 놀이다. 윷의 종류도 장작윷과 밤윷이 있고 놀이 방법도 다양하다. 윷놀이를 통해 그 해 운수를 점쳐보기도 한다.
승경도는 승정도·종경도·종정도 등 여러 가지 이름으로 불린다. 주로 양반 가문의 젊은이들과 여자들이 즐겨 놀던 실내놀이로 관직이나 학업의 등급을 차례로 기입하고 주사위를 던져서 나온 끗수대로 승진하<span adaptation='no'>거나</span> 후퇴하는 방식으로 논다. 돈치기는 정초에 청소년들이 동<span adaptation='no'>전</span>이나 동전 모양의 쇠붙이를 가지고 노는 놀이인데『동국세시기』에는 정월 대보름 편에 기록되어 있다.
대보름에는 더욱 많은 놀이들이 행해진다. 지신밟기를 <span adaptation='no'>비롯</span>하여 줄다리기·고싸움·나무쇠싸움·동채싸움·석전·횃불싸움·놋다리밟기·기와밟기·탈놀이 등 다양한 놀이들이 있다. 특히 대보름놀이로는 불과 관련된 횃불싸움이 절정을 이룬다. 쥐불놀이는 첫 쥐날인 상자일에도 하지만 대보름날 밤에 주로 한다. 보름달 아래에서 즐기는 불놀이는 보름달과 불을 관련시키고 이를 성장, 풍요와도 관련시킨다. 대보름 놀이는 불놀이 뿐 아니라 다른 놀이들도 풍요를 상징하는 것으로 풍요를 기원·예축하는 의미가 있다
.","['전', '거나', '사람', '원래', '비롯']","옛날 사람들은 섣달 그믐부터 대보름까지 여러 가지 놀이를 했어요. 연날리기는 섣달 그믐부터 시작해서 대보름까지 했어요. 대보름날에는 나쁜 일이 생기지 않게 연을 멀리 날려 보냈어요. <span adaptation='no'>원래</span> 보름 뒤에는 연을 날리면 안 됐어요.

설날에는 윷놀이, 널뛰기, 승경도놀이, 돈치기를 했어요. 남녀노소 모두가 함께 즐긴 윷놀이는 집에서도 하고, 밖에서도 마을 사람들과 함께 했어요. 승경도는 주로 양반집 젊은이들이 즐긴 놀이예요. 관직이나 학업 등급을 써놓고 주사위를 던져서 승진하<span adaptation='no'>거나</span> 내려오는 놀이예요. 돈치기는 아이들이 동<span adaptation='no'>전</span>이나 동전처럼 생긴 쇠로 노는 놀이예요.

대보름에는 더 많은 놀이를 했어요. 지신밟기를 <span adaptation='no'>비롯</span>해 줄다리기, 고싸움, 불놀이 등을 했어요. 특히 대보름날 밤에는 횃불놀이를 많이 했어요. 보름달 아래서 하는 불놀이는 좋은 일이 생기기를 바라는 마음을 담고 있어요.",0.8
"
세배 때 하는 절은 ‘전배’인데 이는 ‘<span adaptation='no'>공수</span>’ 자세를 취한 후 몸을 굽혀 절을 하면 된다. 공수는 복부와 주먹 하나 정도의 간격을 두고 두 손을 배꼽 높이에서 가지런히 모으는 것을 말한다. 남자는 왼손이 위로 가도록, 여자는 오른손이 위로 가도록 포갠다.
공수를 한 상태에서 몸을 굽혀 손을 바닥에 <span adaptation='no'>대고</span> 왼쪽 무릎, <span adaptation='no'>오른쪽</span> 무릎 순으로 바닥에 닿게 한 후 손등에 닿을 듯 말 듯하게 머리를 숙인다. 일어설 때는 오른쪽 무릎을 먼저 바닥에서 떼고, 두 손을 오른쪽 무릎 위에 올린 후 왼쪽 다리를 펴며 일어선다. 일어선 후에는 공수한 상태에서 가볍게 고개를 숙이는 ‘읍(揖)’을 한다.
한편, <span adaptation='no'>성균관</span>에 따르면 자손들이 어른들께 세배할 때 절하면서 ‘복 많이 받으세요’, ‘건강하세요’ 등의 덕담을 건네는 경향이 많은데 이는 예법에 어긋난다. 이는 어른의 덕담이 있기를 기다리는 것이 우리나라의 전통 예절이기 때문으로, 절을 받은 어른이 덕담을 건네면 감사의 뜻을 나타내며 답하는 것이 순서이다. 또 세배 순서도 중요한데, 예컨대 조부모가 있을 경우에는 그 자식들이 먼저 세배하고 이어 손주들이 세배를 하도록 한다.
","['성균관', '오른쪽', '대고', '공수']","설날에 하는 세배는 '전배'라고 해요. 먼저 '<span adaptation='no'>공수</span>' 자세를 해야 해요. 공수는 배꼽 높이에서 두 손을 모으는 거예요. 이때 배와 손 사이는 주먹 하나 정도 띄워요. 남자는 왼손을, 여자는 오른손을 위로 해서 손을 포개요.

이렇게 손을 모은 다음에는 몸을 굽혀서 손을 바닥에 <span adaptation='no'>대고</span> 무릎을 꿇어요. 왼쪽 무릎을 먼저 대고, 그다음 <span adaptation='no'>오른쪽</span> 무릎을 대요. 그리고 머리를 살짝 숙여서 손등에 거의 닿을 듯 말 듯하게 해요. 일어날 때는 오른쪽 무릎을 먼저 들고, 두 손을 오른쪽 무릎에 올린 뒤, 왼쪽 다리를 펴면서 일어나요. 다 일어나면 손을 모은 채로 고개를 살짝 숙여요.

<span adaptation='no'>성균관</span>에서는 세배할 때 아이들이 먼저 ""복 많이 받으세요""나 ""건강하세요"" 같은 말을 하면 안 된다고 해요. 어른이 먼저 좋은 말씀을 해 주시면, 그때 ""감사합니다""라고 하는 게 바른 예절이에요. 또 할아버지, 할머니가 계시면 먼저 아버지, 어머니가 세배하고 나서 아이들이 세배해야 해요.",1.0
"
한<span adaptation='no'>옥</span>에서 대문을 들어서면 제일 먼저 만나는 공간이 마당이다. 서양에서 마당과 비슷한 공간은 건물의 중앙에 수직으로 뚫은 중정이다. 중정은 건물 내부의 공간으로 나무와 화초로 정성 들여 가꾸어 놓고 감상하는 정원으로서의 성격이 강하다. 반면에 한옥의 마당은 집의 내부이면서 외부가 되는 공간으로, 일반적으로 비워놓고 집안의 다양한 목적을 충족시키는 복합 생활 공간으로서 <span adaptation='no'>활용</span>하였다.
한옥의 마당은 채워지지 않은 빈 공간이기 때문에 그 활용의 폭이 넓어진다. 집의 여유 공간으로서 마당은 농사일을 준비하고 추수 후에는 한바탕 축제를 열기도 하며 때로는 관혼상제의 의식을 치르는 공간이 된다. 또한 마당의 공간적 여유는 한옥에 거주하는 이에게 심리적 여유를 주기도 한다. 한옥의 방에 들어가면 방이 작아도 좁게 느껴지지 않고 마음이 편안해지는데 이는 창문을 통해 보이는 마당이 좁은 실내 공간을 보완하기 때문이다. 마당으로 들어오는 햇볕과 바람을 통해 자연과 마주하게 되는 경험은 우리의 마음을 여유롭게 하는 데 한몫을 한다. 더욱이 방과 방 사이에 위치한 빈 공간의 마당은 각자의 방에서 거리를 두고 창문을 열어 서로를 바라볼 수 있게 하기 때문에 사람과 사람 간의 멀지도 가깝지도 않은 심정의 거리를 지니게 하는 것이다.
한편, 느슨한 경계선으로서의 한옥의 마당이 지닌 공간적 성격은 자연과 사람, 사람과 사람의 만남을 이끌며 <span adaptation='no'>소통</span>의 공간으로서 기능하게 하였다. 자연과 사람의 중간 영역인 마당을 통해 인간은 자연과 <span adaptation='no'>교감</span>하면서 자연의 품에 들어간다. 채와 채의 중간 영역으로서 마당은 혼례와 같은 잔칫날이나 장례와 같은 통과의례가 치러지는 장소이다. 이때 마당은 외부인을 들이면서 외부인과 내부인의 만남이 일어나게 하고 때로는 <span adaptation='no'>신분</span>을 넘어선 만남도 가능하게 하는 장이 된다.
이렇듯 한옥의 마당은 다양한 용도로 활용 가능한 열린 공간이었다. 마당은 여유 공간으로서 다목적 생활 공간이자 공용 공간이 되었다. 또한 중간 영역으로서 인간과 자연의 소통이 일어났을 뿐만 아니라 가족과 사회 공동체 구성원 간의 소통을 원활하게 하는 공간이었다.
","['활용', '옥', '신분', '교감', '소통']","한<span adaptation='no'>옥</span>의 대문을 열고 들어가면 가장 먼저 마당이 나와요. 서양 집에도 마당 같은 곳이 있는데, 이를 중정이라고 해요. 중정은 건물 안에 있는 예쁜 정원이에요. 하지만 한옥의 마당은 달라요. 마당은 비어있는 공간이라서 여러 가지로 쓸 수 있어요.

마당에서는 농사일도 하고, 추수를 끝내고 잔치도 열어요. 결혼식이나 장례식 같은 중요한 행사도 마당에서 해요. 방이 좁아도 마당이 보이면 마음이 편해져요. 마당으로 들어오는 햇빛과 바람이 기분을 좋게 해주거든요.

마당은 사람들이 만나는 곳이에요. 자연과 가까워질 수 있고, 다른 사람들과도 만날 수 있어요. 잔칫날이나 장례식 때는 마당에 여러 사람이 모여요. <span adaptation='no'>신분</span>이 다른 사람들도 마당에서는 함께 모일 수 있었어요. 

이렇게 마당은 여러 가지로 쓸 수 있는 열린 공간이에요. 가족들이 함께 쓰는 공간이고, 자연과 가까워질 수 있는 공간이에요. 또 다른 사람들과 만나고 이야기를 나누는 곳이기도 해요.",0.4
"
자연에 존재하는 생물의 기본 구조와 기능을 모방하여 공학적으로 활용하는 기술을 생체 모방 기술이라고 한다. 이는 특정 부문에서 인류가 갖지 못한 생물의 특징을 모사하는 기술로 현재의 과학 기술이 맞닥뜨리고 있는 현실적 난제들을 해결하는 데 커다란 영감을 준다.
시속 300킬로미터가 넘는 속도로 달리는 일본의 신칸센 고속 열차는 터널을 빠져 나올 때 <span adaptation='no'>발생</span>하는 엄청난 소음으로인해 터널 주변의 주민들에게 커다란 불편을 주었다. 열차가 좁은 터널에 고속으로 진입하면서 터널 내에 발생한 급격한공기 압축이 강한 파장을 만들어내는데 이<span adaptation='no'>것</span>이 출구를 통해빠져나가면서 엄청난 굉음을 발생시켜 소음을 발생시킨 것이다. 고속 열차 설계를 담당하던 엔지니어들은 터널을 넓혀 문제를 해결하는 방안도 고민했지만 엄청난 비용 문제로 인해 포기하였다. 이에 엔지니어 가운데 한 명은 물고기를 잡기 위해 <span adaptation='no'>물속</span>으로 온몸을 내리꽂는 물총새를 떠올렸다. 물총새는 머리와 몸으로 이어진 길쭉한 부리 모양으로 인해 다이빙할 때 물속 저항을 최소화하면서 속도를 높여 사냥에 성공했던 것이다. 이에 착안해 열차의 앞부분을 물총새의 부리와같이 가늘고 길게 튀어나온 모양으로 디자인하였고 그 결과 기존의 고속 열차에 비해 공기 저항을 크게 감소시켜 소음을 줄이고 속도를 향상시켰을 뿐만 아니라 전력 사용량도 줄일수 있었다.
생체 모방 기술은 단순히 생명체의 외적인 형상만을 모방하는 데 그치지 않는다. 일반적으로 의료용 접착제는 인공 합성한 화학 물질을 재료로 하여 만들어져 왔다. 하지만 홍합을 바위에 잘 달라 붙을 수 있게 하는특유의 접착 단백질은 인체에 무해하다. 이에 연구자들은 홍합의 접착 단백질을 추출해 인체에 염증 반응을 일으키지 않는 의료용 접착제를 개발하였다. <span adaptation='no'>이처럼</span> 생체 모방 기술은 생명체의 몸속 물질의 특성을 활용하여 현실의 문제를 해결하기도 한다.
생체 모방 기술은 인류가 시행착오를 거치지 않고 그 생물이 해결한 문제의 방법을 터득하여 문제 해결에 적용할 수있기에 효율적인 기술이다. 그리고 자연과 조화를 이루며살아가는 생물의 적응 방식을 따라하기에 환경 오염을 일으키지 않는 친환경적인 기술이기도 하다. 그러므로 생명체의 작동 원리에 대한 우리의 지식과 이해가 넓어질수록 생체모방 기술은 앞으로 더욱 발전을 이루고 다양한 분야에 적용될 것으로 보인다.
","['것', '발생', '물속', '이처럼']","생체 모방 기술은 자연에 있는 생물들의 모습이나 특징을 본떠서 만드는 기술이에요. 이런 기술은 우리가 해결하기 어려운 문제들을 풀 때 도움이 돼요.

예를 들어, 일본의 빠른 기차인 신칸센은 터널을 지날 때 큰 소리가 나서 문제였어요. 이 문제를 해결하기 위해 기차를 만드는 사람들은 물고기를 잘 잡는 물총새라는 새를 떠올렸어요. 물총새는 길쭉한 부리 덕분에 물속으로 잘 들어갈 수 있었거든요. 그래서 기차 앞부분을 물총새 부리처럼 길게 만들었더니 소리도 줄이고, 속도도 더 빨라졌어요. 게다가 전기도 덜 쓰게 되었어요.

생체 모방 기술은 겉모습만 따라 하는 게 아니에요. 예를 들어, 바위에 잘 붙는 홍합을 연구해서 몸에 해롭지 않은 의료용 접착제를 만들었어요. <span adaptation='no'>이처럼</span> 생물의 몸속에 있는 특별한 물질을 이용해서 문제를 해결하기도 해요.

생체 모방 기술은 자연에서 해답을 찾기 때문에 시행착오를 줄일 수 있어요. 또 자연과 잘 어울리는 방법을 찾아서 환경도 덜 해쳐요. 앞으로 생물에 대해 더 많이 알게 되면, 생체 모방 기술도 더 발전할 거예요.",0.25
"
함께 심으면 한쪽 또는 양쪽 모두에게 좋은 영향을 주는<span adaptation='no'>식물</span>을 '동반 식물'이라고 합니다. 식물에 따라 함께 심으면좋은 동반 식물이 있습니다. 동반 식물은 도움을 주고받는 방향에 따라 한쪽 식물에게만 도움을 주는 병해충 방제형과 생육 촉진형, 서로 도움을 주고받는 상호 의존형으로나눌 수 있습니다.
병해충 방제형 동반 식물은 함께 심었을 때 다른 식물이병들거나 해충의 피해를 입는 것을 예<span adaptation='no'>방해</span> 줍니다. 예를 들어, 수박이나 오이와 같은 작물은 파와 섞어 심는 것이좋습니다. 파 뿌리에서 나오는 천연 항생 물질이 수박이나 오이에 병과 해충이 생기는 것을 막아 주기 때문입니다.
다음으로 생육 촉진형 동반 식물은 함께 심으면 다른 식물이 성장하는 데 도움을 줍니다. 예를 들어, 가지는 질소를땅속으로 잘 끌어들이는 성질을 가진 콩과 같이 심는 것이좋습니다. 왜냐하면 가지는 성장하는 데 질소 비료를 많이필요로 하기 때문입니다.
마지막으로 상호 의존형 동반 식물은 서로의 부족한 점을 보완해 줍니다. 그래서 함께 심은 식물 모두에게 도움을 줍니다. 예를 들어, 물을 좋아하는 식물인 바질은 건조한 환경을 좋아하는 토마토와 함께 심는 것이 좋습니다. 그러면 땅속의 수분 환경이 적절하게 만들어져서 토마토는 물러 터지지 않고 바질은 마르지 않을 수 있게 됩니다.
예로부터 우리 조상들은 지혜를 발휘하여 텃밭에 채소와꽃, 약초 등을 섞어 심었습니다. 식물의 특성을 고려하여 알맞은 동반 식물을 이웃해 심으면 식물을 더욱 잘 기를수 있습니다.
","['식물', '방해']","어떤 <span adaptation='no'>식물</span>들은 서로 가까이 심으면 좋아요. 이런 <span adaptation='no'>식물</span>들을 '동반 <span adaptation='no'>식물</span>'이라고 해요. 동반 <span adaptation='no'>식물</span>은 세 가지로 나눌 수 있어요.

첫째는 한 <span adaptation='no'>식물</span>이 다른 <span adaptation='no'>식물</span>을 병이나 벌레로부터 지켜주는 거예요. 예를 들어 수박이나 오이는 파랑 같이 심으면 좋아요. 파 뿌리가 나쁜 병균이나 벌레를 막아주거든요.

둘째는 한 <span adaptation='no'>식물</span>이 다른 <span adaptation='no'>식물</span>이 잘 자라도록 도와주는 거예요. 가지는 콩과 함께 심으면 좋아요. 콩이 가지가 필요한 영양분을 만들어주기 때문이에요.

셋째는 두 <span adaptation='no'>식물</span>이 서로 도와주는 거예요. 예를 들어 바질과 토마토를 같이 심으면 좋아요. 바질은 물을 좋아하고 토마토는 물을 싫어해서 서로 딱 맞아요.

옛날부터 우리 조상들은 여러 <span adaptation='no'>식물</span>을 같이 심었어요. 이렇게 서로 잘 맞는 <span adaptation='no'>식물</span>을 같이 심으면 더 잘 자랄 수 있어요.",0.5
"
10대 청소년의 스마트폰 <span adaptation='no'>이용</span> 시간이 늘어가며 스마트폰 중독을 호소하는 학생들이 늘어나고 있다. 과학기술정보통신부의 조사에 따르면, 10대 청소년 10명 중 3명이 스마트폰으로 인해 <span adaptation='no'>생활</span>에 지장을 받는 '스마트폰 과의존 위험군'으로 파악되고 있다.
과도한 스마트폰 사용은 학업이나 일상생활에 지장을 줄뿐만 아니라 <span adaptation='no'>대인</span> 관계, 사고력과 자기조절력에도 문제를 가져오기 때문에 중독을 예방하는 것이 중요하다. 그렇다면 어떻게 스마트폰 중독을 예방할 수 있을까.
첫째, 스마트쉼센터에서 <span adaptation='no'>제공</span>하는 각종 진단 테스트에 참여한다. 얼마나 스마트폰에 의존하는 <span adaptation='no'>상태</span>인지 스스로 파악하기 어렵다. 객관적인 진단 테스트를 통해 자신의 상태를냉정하게 평가해 볼 필요가 있다.
둘째, 스마트폰 중독 예방을 위한 앱이나 서비스를 사용한다. 걸으면서 스마트폰을 쓰면 화면이 잠기거나, 미리 설정한 시간만큼만 스마트폰을 사용하도록 설정하는 앱을 이용한다.
이와 같이, 스마트폰을 쓰지 않을 수 없다면, 스스로 스마트폰 사용을 절제하는 힘을 길러야 한다. 우리 모두 스마트폰 중독을 예방하기 위해 노력해야 한다.
","['생활', '제공', '상태', '이용', '대인']","요즘 10대 친구들이 스마트폰을 너무 많이 써서 걱정이에요. 정부에서 조사해보니 10명 중 3명은 스마트폰을 너무 많이 써서 <span adaptation='no'>생활</span>에 문제가 생기고 있대요.

스마트폰을 너무 많이 쓰면 공부도 못 하고, 친구들과 잘 어울리지도 못해요. 또 생각하는 힘도 떨어지고 자기 마음도 잘 못 다스려요.

그럼 어떻게 하면 좋을까요? 먼저 스마트쉼센터에서 하는 검사를 받아보세요. 내가 스마트폰을 얼마나 많이 쓰는지 정확히 알 수 있어요.

다음으로 스마트폰을 잘 쓸 수 있게 도와주는 앱을 써보세요. 걸을 때는 화면이 꺼지게 하거나, 정해진 시간만 쓸 수 있게 하는 앱이 있어요.

스마트폰은 꼭 필요하지만, 너무 많이 쓰지 않도록 조심해야 해요. 우리 모두 스마트폰을 현명하게 쓰도록 노력해요.",0.2
