original_passage,tagged_words,response_summary,em_score
"
자연에 존재하는 생물의 기본 구조와 기능을 <span adaptation='no'>모방</span>하여 공학적으로 활용하는 기술을 생체 모방 기술이라고 한다. 이는 특정 부문에서 인류가 갖지 <span adaptation='no'>못</span>한 생물의 특징을 모사하는 기술로 현재의 <span adaptation='no'>과학</span> 기술이 맞닥뜨리고 있는 현실적 난제들을 <span adaptation='no'>해결</span>하는 데 커다란 영감을 준다.
시속 300킬로미터가 넘는 속도로 달리는 일본의 신칸센 고속 열차는 터널을 빠져 나올 때 발생하는 엄청난 소음으로인해 터널 주변의 주민들에게 커다란 불편을 주었다. 열차가 좁은 터널에 고속으로 진입하면서 터널 내에 발생한 급격한공기 압축이 강한 파장을 만들어내는데 이것이 출구를 통해빠져나가면서 엄청난 굉음을 발생시켜 소음을 발생시킨 것이다. 고속 열차 설계를 담당하던 엔지니어들은 터널을 넓혀 문제를 해결하는 방안도 고민했지만 엄청난 비용 문제로 인해 포기하였다. 이에 엔지니어 가운데 한 명은 물고기를 잡기 위해 물속으로 온몸을 내리꽂는 물총새를 떠올렸다. 물총새는 머리와 몸으로 이어진 길쭉한 부리 모양으로 인해 다이빙할 때 물속 저항을 최소화하면서 속도를 높여 사냥에 성공했던 것이다. 이에 착안해 열차의 앞부분을 물총새의 부리와같이 가늘고 길게 튀어나온 모양으로 디자인하였고 <span adaptation='no'>그</span> 결과 기존의 고속 열차에 비해 공기 저항을 크게 감소시켜 소음을 줄이고 속도를 향상시켰을 뿐만 아니라 전력 사용량도 줄일수 있었다.
생체 모방 기술은 단순히 생명체의 외적인 형상만을 모방하는 데 그치지 않는다. 일반적으로 의료용 접착제는 인공 합성한 화학 물질을 재료로 하여 만들어져 왔다. 하지만 홍합을 바위에 잘 달라 붙을 수 있게 하는특유의 접착 단백질은 인체에 무해하다. 이에 연구자들은 홍합의 접착 단백질을 추출해 인체에 염증 반응을 일으키지 않는 의료용 접착제를 개발하였다. 이처럼 생체 모방 기술은 생명체의 몸속 물질의 특성을 활용하여 현실의 문제를 해결하기도 한다.
생체 모방 기술은 인류가 시행착오를 거치지 않고 그 생물이 해결한 문제의 방법을 터득하여 문제 해결에 적용할 수있기에 효율적인 기술이다. 그리고 자연과 조화를 이루며살아가는 생물의 적응 방식을 따라하기에 환경 오염을 일으키지 않는 친환경적인 기술이기도 하다. 그러므로 생명체의 작동 원리에 대한 우리의 지식과 이해가 넓어질수록 생체모방 기술은 앞으로 더욱 발전을 이루고 다양한 분야에 적용될 것으로 보인다.
","['모방', '과학', '못', '그', '해결']","생체 모방 기술은 자연에 있는 생물들의 특징을 따라 만든 기술이에요. 생물들이 가진 좋은 점을 우리가 배워서 쓰는 거예요.

예를 들어, 일본의 빠른 기차인 신칸센은 터널을 나올 때 시끄러운 소리가 났어요. 이 문제를 해결하기 위해 기술자들은 물고기를 잡는 물총새라는 새를 보았어요. 물총새는 부리가 길쭉해서 물속으로 잘 들어갈 수 있어요. 기술자들은 기차 앞부분을 물총새 부리처럼 만들었더니 소리도 줄어들고, 속도도 더 빨라졌어요. 전기도 덜 써서 좋았어요.

생체 모방 기술은 생물의 겉모습뿐 아니라 몸속 특징도 따라 해요. 예를 들어 홍합은 바위에 잘 붙어요. 연구자들은 홍합이 바위에 붙는 방법을 연구해서 몸에 해가 없는 접착제를 만들었어요.

생체 모방 기술은 자연에서 배우기 때문에 환경에도 좋아요. 생물들이 어떻게 살아가는지 더 많이 알수록, 이 기술도 더 발전할 거예요.",0.0
"
함께 심으면 한쪽 또는 양쪽 모두에게 좋은 영향을 주는식물을 '동반 식물'이라고 합니다. 식물에 따라 함께 심으면좋은 동반 식물이 있습니다. 동반 식물은 도움을 주고받는 방향에 따라 한쪽 식물에게만 도움을 주는 병해충 <span adaptation='no'>방제</span>형과 생육 촉진형, 서로 도움을 주고받는 상호 의존형으로나눌 수 있습니다.
병해충 방제형 동반 식물은 함께 심었을 때 다른 식물이병들거나 해충의 피해를 입는 것을 예방해 줍니다. 예를 들어, 수박이나 오이와 같은 작물은 파와 섞어 심는 것이좋습니다. 파 뿌리에서 나오는 천연 항생 물질이 수박이나 오이에 병과 해충이 생기는 것을 막아 주기 때문입니다.
다음으로 생육 촉진형 동반 식물은 함께 심으면 다른 식물이 성장하는 데 도움을 줍니다. 예를 들어, 가지는 질소를땅속으로 잘 끌어들이는 성질을 가진 콩과 같이 심는 것이좋습니다. 왜냐하면 가지는 성장하는 데 질소 비료를 많이필요로 하기 때문입니다.
마지막으로 상호 의존형 동반 식물은 서로의 부족한 점을 보완해 줍니다. 그래서 함께 심은 식물 모두에게 도움을 줍니다. 예를 들어, 물을 좋아하는 식물인 바질은 건조한 환경을 좋아하는 토마토와 함께 심는 것이 좋습니다. 그러면 땅속의 수분 환경이 적절하게 만들어져서 토마토는 물러 터지지 않고 바질은 마르지 않을 수 있게 됩니다.
예로부터 우리 조상들은 지혜를 발휘하여 텃밭에 채소와꽃, 약초 등을 섞어 심었습니다. 식물의 특성을 고려하여 알맞은 동반 식물을 이웃해 심으면 식물을 더욱 잘 기를수 있습니다.
",['방제'],"식물을 함께 심으면 서로 도움이 되는 경우가 있어요. 이런 식물들을 '동반 식물'이라고 해요. 동반 식물에는 세 가지 종류가 있어요.
첫 번째로, 어떤 식물은 다른 식물이 병에 걸리지 않게 도와줘요. 예를 들어 파는 수박이나 오이가 병에 걸리지 않게 도와줘요. 파 뿌리에서 나오는 물질이 수박과 오이를 지켜주기 때문이에요.
두 번째로, 어떤 식물은 다른 식물이 잘 자라도록 도와줘요. 예를 들어 콩은 가지가 잘 자라도록 도와줘요. 콩이 땅속에서 가지가 필요한 영양분을 만들어주기 때문이에요.
세 번째로, 어떤 식물들은 서로 도와가며 자라요. 예를 들어 바질과 토마토를 함께 심으면 좋아요. 바질은 물을 좋아하고 토마토는 물을 적게 좋아해서, 함께 심으면 둘 다 알맞게 물을 얻을 수 있어요.
옛날부터 우리 할아버지, 할머니들은 이런 점을 잘 알고 있었어요. 그래서 채소, 꽃, 약초를 함께 심었어요. 이렇게 서로 도움이 되는 식물을 함께 심으면 식물들이 더 잘 자라요.",0.0
"
10대 청소년의 스마트폰 이용 시간이 늘어가며 스마트폰 중독을 호소하는 학생들이 늘어나고 있다. 과학기술정보통신부의 조사에 따르면, 10대 청소년 10명 중 3명이 스마트폰으로 인해 생활에 지장을 받는 '스마트폰 과의존 위험군'으로 파악되고 있다.
과도한 스마트폰 <span adaptation='no'>사용</span>은 학업이나 일상생활에 지장을 줄뿐만 아니라 대인 관계, 사고력과 자기조절력에도 문제를 가져오기 때문에 중독을 예방하는 것이 중요하다. 그렇다면 어떻게 스마트폰 중독을 예방할 수 있을까.
첫째, 스마트쉼센터에서 제공하는 각종 진단 테스트에 참여한다. 얼마나 스마트폰에 의존하는 상태인지 스스로 파악하기 어렵다. 객관적인 진단 테스트를 통해 자신의 상태를냉정하게 평가해 볼 필요가 있다.
둘째, 스마트폰 중독 예방을 위한 앱이나 서비스를 사용한다. 걸으면서 스마트폰을 쓰면 화면이 잠기거나, 미리 설정한 시간만큼만 스마트폰을 사용하도록 설정하는 앱을 이용한다.
이와 같이, 스마트폰을 쓰지 않을 수 없다면, 스스로 스마트폰 사용을 절제하는 힘을 길러야 한다. 우리 모두 스마트폰 중독을 예방하기 위해 노력해야 한다.
",['사용'],"요즘 10대 친구들이 스마트폰을 너무 많이 써서 걱정이에요. 정부에서 조사해보니 10명 중 3명의 친구들이 스마트폰 때문에 일상생활에 어려움을 겪고 있대요.

스마트폰을 너무 많이 쓰면 공부도 못 하고, 다른 사람과 잘 지내기도 어려워요. 또 생각하는 힘과 자신을 조절하는 힘도 약해질 수 있어요. 그래서 미리 조심하는 게 중요해요.

어떻게 하면 스마트폰을 건강하게 쓸 수 있을까요?

첫째로, 스마트쉼센터에서 하는 검사를 받아보세요. 내가 스마트폰을 얼마나 많이 쓰는지 혼자서는 알기 어려워요. 검사를 통해 내 상태를 정확히 알아보는 게 좋아요.

둘째로, 스마트폰을 지나치게 쓰지 않도록 도와주는 앱을 써보세요. 걸으면서 스마트폰을 쓰면 화면이 꺼지거나, 정해진 시간만 쓸 수 있게 하는 앱이 있어요.

스마트폰을 안 쓸 수는 없지만, 스스로 조절하면서 쓰는 법을 배워야 해요. 우리 모두 스마트폰을 건강하게 쓰도록 노력해요.",0.0
"
놀이는 이미 섣달 그믐 무렵부터 즐기기 시작하여 대보름 무렵까지 즐긴다. 연날리기는 섣달 그믐 무렵부터 시작하여 대보름까지 즐긴다. 보름날의 연은 액연이라 하여 멀리 날려보낸다. 원래 보름날 이후에는 연을 날리지 않는 것이다. 그밖에 설날 무렵 윷놀이·널뛰기·승경도놀이·돈치기 등을 한다. 윷놀이는 남녀노소 구별 없이 모든 사람이 집안에서도 하고 밖에서 마을 사람들이 어울려 하는 정초의 가장 보편적인 놀이다. 윷의 <span adaptation='no'>종</span>류도 장작윷과 밤윷이 있고 놀이 방법도 다양하다. 윷놀이를 통해 그 해 운수를 점쳐보기도 한다.
승경도는 승정도·종경도·종정도 등 여러 가지 이름으로 불린다. 주로 양반 가문의 젊은이들과 여자들이 즐겨 놀던 실내놀이로 관직이나 학업의 등급을 차례로 기입하고 주사위를 던져서 나온 끗수대로 승진하거나 후퇴하는 방식으로 논다. 돈치기는 정초에 청소년들이 동전이나 동전 모양의 쇠붙이를 가지고 노는 놀이인데『동국세시기』에는 정월 대보름 편에 기록되어 있다.
대보름에는 더욱 많은 놀이들이 행해진다. 지신밟기를 비롯하여 줄다리기·고싸움·나무쇠싸움·동채싸움·석전·횃불싸움·놋다리밟기·기와밟기·탈놀이 등 다양한 놀이들이 있다. 특히 대보름놀이로는 <span adaptation='no'>불과</span> 관련된 횃불싸움이 절정을 이룬다. 쥐불놀이는 첫 쥐날인 상자일에도 하지만 대보름날 밤에 주로 한다. 보름달 아래에서 즐기는 불놀이는 보름달과 불을 관련시키고 이를 성장, 풍요와도 관련시킨다. 대보름 놀이는 불놀이 뿐 아니라 다른 놀이들도 풍요를 상징하는 것으로 풍요를 기원·예축하는 의미가 있다
.","['불과', '종']","옛날 사람들은 섣달 그믐부터 대보름까지 여러 가지 놀이를 했어요. 연날리기는 섣달 그믐부터 시작해서 대보름까지 했어요. 대보름날에는 나쁜 운을 멀리 보내기 위해 연을 하늘 높이 날려 보냈어요. 대보름이 지나면 연을 더 이상 날리지 않았어요.

설날에는 윷놀이, 널뛰기, 승경도놀이, 돈치기 같은 놀이를 했어요. 윷놀이는 나이나 성별에 상관없이 모두가 즐길 수 있는 놀이였어요. 집안에서도 하고, 마을 사람들과 함께 밖에서도 했어요. 윷은 장작으로 만든 것과 밤으로 만든 것이 있었어요. 사람들은 윷놀이로 그 해의 운수도 알아보려 했어요.

대보름에는 더 많은 놀이를 했어요. 지신밟기, 줄다리기, 불놀이 같은 것들이에요. 특히 횃불을 가지고 노는 불놀이를 많이 했어요. 쥐불놀이는 보름달이 뜨는 밤에 주로 했어요. 사람들은 이런 놀이들이 좋은 일이 생기게 해준다고 믿었어요.",0.0
"
세배 때 하는 <span adaptation='no'>절</span>은 ‘전배’인데 이는 ‘공수’ 자세를 취한 후 몸을 굽혀 절을 하면 된다. 공수는 복부와 주먹 하나 정도의 간격을 두고 두 손을 배꼽 높이에서 가지런히 모으는 것을 말한다. 남자는 왼손이 위로 가도록, 여자는 오른손이 위로 가도록 포갠다.
공수를 한 상태에서 몸을 굽혀 손을 바닥에 대고 왼쪽 무릎, <span adaptation='no'>오른쪽</span> 무릎 순으로 바닥에 닿게 한 후 손등에 닿을 듯 말 듯하게 머리를 숙인다. 일어설 때는 오른쪽 무릎을 먼저 바닥에서 떼고, 두 손을 오른쪽 무릎 위에 올린 후 왼쪽 다리를 펴며 일어선다. 일어선 후에는 공수한 상태에서 가볍게 고개를 숙이는 ‘읍(揖)’을 한다.
한편, 성균관에 따르면 자손들이 어른들께 세배할 때 절하면서 ‘복 많이 받으세요’, ‘건강하세요’ 등의 덕담을 건네는 경향이 많은데 이는 예법에 어긋난다. 이는 어른의 덕담이 있기를 기다리는 것이 우리나라의 전통 예절이기 때문으로, 절을 받은 어른이 덕담을 건네면 감사의 뜻을 나타내며 답하는 것이 순서이다. 또 세배 순서도 중요한데, 예컨대 조부모가 있을 경우에는 그 자식들이 먼저 세배하고 이어 손주들이 세배를 하도록 한다.
","['오른쪽', '절']","설날에 하는 <span adaptation='no'>절</span>을 '전배'라고 해요. 먼저 '공수' 자세를 해야 해요. 공수는 배꼽 높이에서 두 손을 모으는 건데, 배와 손 사이는 주먹 하나 정도 띄워요. 남자아이는 왼손을, 여자아이는 오른손을 위로 올려서 포개요.

그 다음엔 몸을 숙여서 손을 바닥에 대요. 그리고 왼쪽 무릎, <span adaptation='no'>오른쪽</span> 무릎 순서로 바닥에 대요. 머리는 손등에 살짝 닿을 듯 말 듯하게 숙여요. 일어날 때는 오른쪽 무릎을 먼저 떼고, 두 손을 오른쪽 무릎에 올려요. 그리고 왼쪽 다리를 펴면서 일어나요. 다 일어난 후에는 공수 자세로 고개를 살짝 숙여요.

세배할 때는 아이들이 먼저 덕담을 하면 안 돼요. 어른이 덕담을 해주실 때까지 기다려야 해요. 어른이 덕담을 해주시면 그때 ""감사합니다""라고 말씀드리면 돼요. 또, 할아버지 할머니가 계시면 부모님이 먼저 세배하고, 그 다음에 아이들이 세배해야 해요.",1.0
"
애플<span adaptation='no'>이</span> 집단 소송에 대한 합의금으로 9천5<span adaptation='no'>백만</span> 달러에 달하는 금액을 지불하기로 했습니다. 원고 측은 애플의 '인공지능 비서' Siri가 갑자기 켜져서 이용자의 동의 없이 기밀 사항 또는 사적인 내용이 포함된 <span adaptation='no'>대화</span> 내용을 수집해 제3자에게 제공했다고 주장하며 소송을 제기했어요. 사실 애플이 이 '혐의'를 인정한 것은 아니에요. USD 95M 정도로 이 소송을 '종료하기로' 합의를 본 건데요, 애플 입장에서는 소송을 더 이끌어나가는 위험을 감수하는 것보다 그냥 빨리 이 건을 마무리짓는 게 낫겠다고 본 것이죠. 애플은 이전에도 집단 소송을 몇 번 경험한 적이 있어요. 작년 1월에는 의도적으로 아이폰이 느려지게 했다는 혐의로 5억짜리 소송에 휘말렸고, 3월에는 중국에서의 매출 감소에 대한 사실을 주주들에게 은폐했다는 이유로 4.9억을 지불한 바 있어요. 11월에도 영국의 iCloud 사용자를 소위 '앱등이'로 만들고 사용료를 과하게 부과했다며 소송을 당했고요. 이런 것들에 비하면 9천5백만 달러 정도는 귀엽게 느껴지기까지 하네요.","['이', '백만', '대화']","애플<span adaptation='no'>이</span> 9천5<span adaptation='no'>백만</span> 달러(약 1,200억 원)를 내기로 했어요. 사람들은 애플의 음성 도우미 시리(Siri)가 자기들 모르게 켜져서 개인적인 <span adaptation='no'>대화</span>를 몰래 듣고 다른 사람들에게 알려줬다고 화를 냈어요. 애플은 이런 일을 했다고 인정하지는 않았지만, 긴 싸움을 피하고 싶어서 돈을 내기로 했어요.

애플은 전에도 이런 문제로 돈을 낸 적이 있어요. 작년에는 아이폰을 일부러 느리게 만들었다고 해서 5억 달러를, 중국에서 장사가 잘 안 된다는 걸 숨겼다고 해서 4.9억 달러를 냈어요. 또 영국에서는 아이클라우드 값을 너무 비싸게 받았다며 혼이 났어요. 이런 것들과 비교하면 이번에 내기로 한 돈은 그리 많지 않아 보여요.",1.0
"
한옥에서 대문을 들어서면 제일 먼저 만나는 공간이 마당이다. 서양에서 마당과 비슷한 공간은 건물의 중앙에 수직으로 뚫은 중정이다. 중정은 건물 내부의 공간으로 나무와 화초로 정성 들여 가꾸어 놓고 감상하는 정원으로서의 성격이 강하다. 반면에 한옥의 마당은 집의 내부이면서 외부가 되는 공간으로, 일반적으로 비워놓고 집안의 다양한 목적을 충족시키는 복합 생활 공간으로서 활용하였다.
한옥의 마당은 채워지지 않은 빈 공간이기 때문에 그 활용의 폭이 넓어진다. 집의 여유 공간으로서 마당은 <span adaptation='no'>농사일</span>을 준비하고 추수 후에는 한바탕 축제를 열기도 하며 때로는 관혼상제의 의식을 치르는 공간이 된다. 또한 마당의 공간적 여유는 한옥에 거주하는 이에게 심리적 여유를 주기도 한다. 한옥의 방에 들어가면 방이 작아도 좁게 느껴지지 않고 마음이 편안해지는데 이는 창문을 통해 보이는 마당이 좁은 실내 공간을 보완하기 때문이다. 마당으로 들어오는 햇볕과 바람을 통해 자연과 마주하게 되는 경험은 우리의 마음을 여유롭게 하는 데 한몫을 한다. 더욱이 방과 방 사이에 위치한 빈 공간의 마당은 각자의 방에서 거리를 두고 창문을 열어 서로를 바라볼 수 있게 하기 때문에 사람과 사람 간의 멀지도 가깝지도 않은 심정의 거리를 지니게 하는 것이다.
한편, 느슨한 경계선으로서의 한옥의 마당이 지닌 공간적 성격은 자연과 사람, 사람과 사람의 만남을 이끌며 소통의 공간으로서 기능하게 하였다. 자연과 사람의 중간 영역인 마당을 통해 인간은 자연과 교감하면서 자연의 품에 들어간다. 채와 채의 중간 영역으로서 마당은 혼례와 같은 잔칫날이나 장례와 같은 통과의례가 치러지는 장소이다. 이때 마당은 외부인을 들이면서 외부인과 내부인의 만남이 일어나게 하고 때로는 신분을 넘어선 만남도 가능하게 하는 장이 된다.
이렇듯 한옥의 마당은 다양한 용도로 활용 가능한 열린 공간이었다. 마당은 여유 공간으로서 다목적 생활 공간<span adaptation='no'>이자</span> 공용 공간이 되었다. 또한 중간 영역으로서 인간과 자연의 소통이 일어났을 뿐만 아니라 가족과 사회 공동체 구성원 간의 소통을 원활하게 하는 공간이었다.
","['이자', '농사일']","한옥에 들어가면 제일 먼저 마당이 있어요. 서양 집에도 비슷한 공간이 있는데, 이를 중정이라고 해요. 중정은 건물 가운데 있는 정원이에요. 하지만 한옥의 마당은 달라요. 마당은 비어있는 공간이어서 여러 가지로 쓸 수 있어요.

한옥의 마당은 비어있기 때문에 무엇이든 할 수 있어요. <span adaptation='no'>농사일</span>도 하고, 잔치도 열고, 결혼식이나 장례식도 할 수 있어요. 또 마당이 있어서 방이 작아도 답답하지 않아요. 창문으로 마당을 보면 마음이 편안해져요. 마당에서 햇빛도 쐬고 바람도 느끼면서 자연을 만날 수 있어요.

마당은 자연과 사람, 사람과 사람이 만나는 곳이에요. 마당에서 자연을 느끼고, 다른 사람들과도 만날 수 있어요. 결혼식이나 장례식 같은 큰 행사도 마당에서 해요. 마당은 누구나 만날 수 있는 곳이에요.

이처럼 한옥의 마당은 여러 가지로 쓸 수 있는 열린 공간이에요. 마당은 많은 일을 할 수 있는 공간이면서, 자연과 사람들이 만나는 곳이에요.",0.5
"
자연에 존재하는 생물의 기본 구조와 기능을 모방하여 공학적으로 활용하는 기술을 생체 모방 기술이라고 한다. 이는 특정 부문에서 인류가 갖지 못한 생물의 특징을 모사하는 기술로 현재의 과학 기술이 맞닥뜨리고 있는 현실적 난제들을 해결하는 <span adaptation='no'>데</span> 커다란 영감을 준다.
시속 300킬로미터가 넘는 속도로 달리는 일본의 신칸센 고속 열차는 터널을 빠져 나올 때 발생하는 엄청난 소음으로인해 터널 주변의 주민들에게 커다란 불편을 주었다. 열차가 좁은 터널에 고속으로 진입하면서 터널 내에 발생한 급격한공기 압축이 강한 파장을 만들어내는데 이것이 출구를 통해빠져나가면서 엄청난 굉음을 발생시켜 소음을 발생시킨 것이다. 고속 열차 설계를 담당하던 엔지니어들은 터널을 넓혀 문제를 해결하는 방안도 고민했지만 엄청난 비용 문제로 인해 포기하였다. 이에 엔지니어 가운데 한 명은 물고기를 잡기 위해 물속으로 온몸을 내리꽂는 물총새를 떠올렸다. 물총새는 머리와 몸으로 이어진 길쭉한 부리 모양으로 인해 다이빙할 때 물속 저항을 최소화하면서 속도를 높여 사냥에 성공했던 것이다. 이에 착안해 열차의 앞부분을 물총새의 부리와같이 가늘고 길게 튀어나온 모양으로 디자인하였고 그 결과 기존의 고속 열차에 비해 공기 저항을 크게 감소시켜 소음을 줄이고 속도를 향상시켰을 뿐만 아니라 전력 사용량도 줄일수 있었다.
생체 모방 기술은 단순히 생명체의 외적인 형상만을 모방하는 데 그치지 않는다. 일반적으로 의료용 접착제는 인공 합성한 화학 물질을 재료로 하여 만들어져 왔다. 하지만 홍합을 바위에 잘 달라 붙을 수 있게 하는특유의 접착 단백질은 인체에 무해하다. 이에 연구자들은 홍합의 접착 단백질을 추출해 인체에 염증 <span adaptation='no'>반응</span>을 일으키지 않는 의료용 접착제를 개발하였다. 이처럼 생체 모방 기술은 생명체의 몸속 물질의 특성을 활용하여 현실의 문제를 해결하기도 한다.
생체 모방 기술은 인류가 시행착오를 거치지 않고 그 생물이 해결한 문제의 방법을 터득하여 문제 해결에 적용할 수있기에 효율적인 기술이다. 그리고 자연과 조화를 이루며살아가는 생물의 적응 방식을 따라하기에 환경 오염을 일으키지 않는 친환경적인 기술이기도 하다. 그러므로 생명체의 작동 원리에 대한 우리의 지식과 이해가 넓어질수록 생체모방 기술은 앞으로 <span adaptation='no'>더욱</span> <span adaptation='no'>발전</span>을 이루고 다양한 분야에 적용될 것으로 보인다.
","['더욱', '반응', '데', '발전']","생체 모방 기술은 자연에 사는 생물들의 생김새나 특징을 본떠서 만드는 기술이에요. 이 기술은 우리가 해결하기 어려운 문제들을 풀어내는 <span adaptation='no'>데</span> 도움을 줘요.

일본의 빠른 기차인 신칸센은 터널을 지날 때 큰 소리가 났어요. 이 소리 때문에 터널 근처에 사는 사람들이 많이 불편했죠. 기차가 터널에 들어갈 때 생기는 공기의 압력이 너무 세서 큰 소리가 났기 때문이에요. 기술자들은 이 문제를 해결하려고 고민했어요. 그러다 물고기를 잡으려고 물속으로 빠르게 내려가는 물총새를 떠올렸어요. 물총새는 부리가 길고 뾰족해서 물속으로 잘 들어갈 수 있었거든요. 그래서 기차 앞부분을 물총새 부리처럼 만들었더니 소음도 줄고, 속도도 더 빨라졌어요. 전기도 덜 쓰게 되었고요.

생체 모방 기술은 생물의 겉모습뿐만 아니라 몸속 물질도 본떠요. 의사들이 쓰는 접착제는 보통 화학 물질로 만들어요. 그런데 과학자들이 홍합이 바위에 붙는 방법을 연구했어요. 홍합은 몸에서 나오는 특별한 단백질로 바위에 붙어요. 이 단백질로 만든 접착제는 우리 몸에 해롭지 않아요.

생체 모방 기술은 자연에서 답을 찾아서 시간도 아끼고, 환경도 지킬 수 있어요. 우리가 생물에 대해 더 많이 알수록 이 기술은 <span adaptation='no'>더욱</span> <span adaptation='no'>발전</span>할 거예요.",0.75
